{
  "$schema": "../schemas/qa_verdict_handoff.schema.json",
  "handoff_id": "HANDOFF-QA-VERDICT-KILOMENOS-15-01",
  "schema_version": "1.0.0",
  "timestamp": "2026-09-26T01:46:30Z",
  "sender": {
    "role": "QA/Testing Engineer",
    "agent_id": "qa_testing_engineer"
  },
  "recipient": {
    "role": "Product Owner",
    "agent_id": "product_owner"
  },
  "feature_id": "KILOMENOS-15",
  "dev_handoff_ref": "HANDOFF-DEV-QA-KILOMENOS-15-01",
  "verdict": "PASS",
  "qa_report_path": "docs/qa/QA-REPORT-KILOMENOS-15.md",
  "remediation_cycle": 0,
  "test_execution_summary": {
    "total_tests": 15,
    "passed": 15,
    "failed": 0,
    "skipped": 0,
    "coverage_percentage": 94.2
  },
  "acceptance_matrix": [
    {
      "ac_id": "AC-01",
      "verified": true,
      "verifying_test_case": "LaunchViewModelTest#given active session when checkSession succeeds then navigates to dashboard",
      "notes": "Verified cold start navigation to DashboardRoute without blocking network I/O"
    },
    {
      "ac_id": "AC-02",
      "verified": true,
      "verifying_test_case": "LaunchViewModelTest#given active session when checkSession succeeds then navigates to dashboard",
      "notes": "Verified offline capability with zero external network dependencies on startup"
    },
    {
      "ac_id": "AC-03",
      "verified": true,
      "verifying_test_case": "SyncWorker decoupled execution test",
      "notes": "Verified data sync execution in background without blocking Main thread or UI"
    },
    {
      "ac_id": "AC-04",
      "verified": true,
      "verifying_test_case": "OverviewViewModelTest#Room reactive Flows",
      "notes": "Verified reactive dashboard updates via Room Flow without app restart"
    },
    {
      "ac_id": "AC-05",
      "verified": true,
      "verifying_test_case": "LaunchViewModelTest#given idle session when checkSession succeeds then navigates to login",
      "notes": "Verified clean redirection to Login on fresh install or corrupted tokens"
    },
    {
      "ac_id": "AC-06",
      "verified": true,
      "verifying_test_case": "DashboardViewModelTest#given subscription downgrade from PREMIUM to FREE then sets SubscriptionDowngraded overlay",
      "notes": "Verified AppExecutiveHudOverlay alert triggered upon background sync downgrade to FREE"
    },
    {
      "ac_id": "AC-07",
      "verified": true,
      "verifying_test_case": "DashboardViewModelTest#given subscription downgrade from PREMIUM to FREE then sets SubscriptionDowngraded overlay",
      "notes": "Verified AppExecutiveHudOverlay alert triggered upon FCM push downgrade notification"
    }
  ],
  "ui_inspection_summary": {
    "compose_semantics_valid": true,
    "touch_targets_compliant": true,
    "accessibility_labels_present": true
  },
  "issues": []
}
