{
  "handoff_id": "HANDOFF-QA-VERDICT-KILOMENOS-16",
  "schema_version": "1.0.0",
  "timestamp": "2026-09-26T15:43:00Z",
  "sender": {
    "role": "QA/Testing Engineer",
    "agent_id": "qa_testing_engineer"
  },
  "recipient": {
    "role": "Product Owner",
    "agent_id": "product_owner"
  },
  "feature_id": "KILOMENOS-16",
  "dev_handoff_ref": "HANDOFF-DEV-QA-KILOMENOS-16",
  "verdict": "PASS",
  "qa_report_path": "docs/qa/QA-REPORT-KILOMENOS-16.md",
  "remediation_cycle": 0,
  "test_execution_summary": {
    "total_tests": 10,
    "passed": 10,
    "failed": 0,
    "skipped": 0,
    "coverage_percentage": 94.2
  },
  "acceptance_matrix": [
    {
      "ac_id": "AC-01",
      "verified": true,
      "verifying_test_case": "HistoryRepositoryImplTest#given record when saveRecord then inserts into Room as PENDING immediately and syncs remotely in background",
      "notes": "Local insert as PENDING before background remote call"
    },
    {
      "ac_id": "AC-02",
      "verified": true,
      "verifying_test_case": "HistoryRepositoryImplTest#given remote sync network failure when saveRecord then schedules retry via syncManager",
      "notes": "Offline failure persists in Room and triggers scheduleSync"
    },
    {
      "ac_id": "AC-03",
      "verified": true,
      "verifying_test_case": "HistoryRepositoryImplTest#given record when saveRecord then inserts into Room as PENDING immediately and syncs remotely in background",
      "notes": "Background remote sync completes and updates status"
    },
    {
      "ac_id": "AC-04",
      "verified": true,
      "verifying_test_case": "HistoryRepositoryImplTest#given PENDING record when deleteRecord then deletes from Room and skips remote DELETE API",
      "notes": "Deletes PENDING record locally with zero remote HTTP calls"
    },
    {
      "ac_id": "AC-05",
      "verified": true,
      "verifying_test_case": "AddOdometerRecordUseCaseTest#given non-positive odometer value when invoke then returns failure without repository interaction",
      "notes": "Invalid input rejected before DB write"
    }
  ],
  "ui_inspection_summary": {
    "compose_semantics_valid": true,
    "touch_targets_compliant": true,
    "accessibility_labels_present": true
  },
  "issues": []
}
