{
  "handoff_id": "HANDOFF-QA-VERDICT-FEAT-004",
  "schema_version": "1.0.0",
  "timestamp": "2026-09-23T19:50:00Z",
  "sender": {
    "role": "QA/Testing Engineer",
    "agent_id": "qa_testing_engineer"
  },
  "recipient": {
    "role": "Product Owner",
    "agent_id": "product_owner"
  },
  "feature_id": "FEAT-004",
  "dev_handoff_ref": "HANDOFF-DEV-QA-FEAT-004",
  "verdict": "PASS",
  "qa_report_path": "docs/qa/QA-REPORT-FEAT-004.md",
  "remediation_cycle": 0,
  "test_execution_summary": {
    "total_tests": 42,
    "passed": 42,
    "failed": 0,
    "skipped": 0,
    "coverage_percentage": 94.1
  },
  "acceptance_matrix": [
    {
      "ac_id": "AC-01",
      "verified": true,
      "verifying_test_case": "OverviewViewModelTest#givenTripProjectionOverlimitThenPublishesCriticalNotification",
      "notes": "Verified projection notification generated with canonical UUID v4 and projection_key in data"
    },
    {
      "ac_id": "AC-02",
      "verified": true,
      "verifying_test_case": "NotificationRepositoryImplTest#givenCanonicalUUIDWhenMarkAsReadThenUpdatesDAOOptimisticallyAndCallsRemoteAPI",
      "notes": "Verified optimistic local read in Room and background PATCH /read with valid UUID"
    },
    {
      "ac_id": "AC-03",
      "verified": true,
      "verifying_test_case": "NotificationRepositoryImplTest#givenPendingNotificationsWithValidUUIDWhenSyncPendingThenSendsBatchToAPIAndMarksSYNCED",
      "notes": "Verified batch sync passes valid UUID and data map to POST /sync"
    },
    {
      "ac_id": "AC-04",
      "verified": true,
      "verifying_test_case": "NotificationRepositoryImplTest#givenNotificationWithSemanticKeyWhenAlreadyExistsInRoomThenUpdatesExistingPreservingUUID",
      "notes": "Verified semantic key deduplication in Room prevents redundant notification cards"
    },
    {
      "ac_id": "AC-05",
      "verified": true,
      "verifying_test_case": "NotificationRepositoryImplTest#givenLegacyNonUUIDIDWhenMarkAsReadThenUpdatesDAOOptimisticallyAndSkipsRemoteAPI",
      "notes": "Verified defensive guard skips remote API call for legacy non-UUID IDs, preventing HTTP 500 in PostgreSQL"
    },
    {
      "ac_id": "AC-06",
      "verified": true,
      "verifying_test_case": "OverviewViewModelTest#givenPremiumUserWithAutotrackingAndVehicleWithoutBluetoothThenPublishesWarningNotification",
      "notes": "Verified Bluetooth warning notification generated with UUID v4 and deduplication_key in data"
    }
  ],
  "ui_inspection_summary": {
    "compose_semantics_valid": true,
    "touch_targets_compliant": true,
    "accessibility_labels_present": true
  },
  "issues": []
}
